,Date,Time,URL,Title,Location,Committee,Date Scraped,witnesses,video_url,Unnamed: 0,Unnamed: 0.1,Unnamed: 0.1.1,Unnamed: 0.1.1.1,Unnamed: 0.1.1.1.1
102,06/26/08,09:30AM,https://www.veterans.senate.gov/hearings/markup-pending-legislation-062608,Markup: Pending Legislation,Dirksen 562,Veterans,2021-12-23,['Daniel Akaka'],https://www.veterans.senate.gov/hearings/watch?hearingid=71E7C338-5056-A032-526B-FBE7824D6A2E,102.0,102.0,102.0,102.0,102.0
103,06/26/08,12:00PM,https://www.veterans.senate.gov/hearings/nomination-of-christine-hill-to-be-an-assistant-secretary-of-veterans-affairs-congressional-affairs,Nomination of Christine Hill to be an Assistant Secretary of Veterans Affairs (Congressional Affairs),Russell Senate Office Building SR-418,Veterans,2021-12-23,['Christine O.Hill'],https://www.veterans.senate.gov/hearings/watch?hearingid=719F531B-5056-A032-527A-75BB38ECB7B3,103.0,103.0,103.0,103.0,103.0
104,07/03/08,10:30AM,https://www.veterans.senate.gov/hearings/caring-for-americas-aging-veterans,Field Hearing - Caring for America's Aging Veterans,"Tupelo, MS ",Veterans,2021-12-23,[],,104.0,104.0,104.0,104.0,104.0
105,07/09/08,09:30AM,https://www.veterans.senate.gov/hearings/review-of-veterans-disability-compensation-undue-delay-in-claims-processing,Review of Veterans' Disability Compensation: Undue Delay in Claims Processing,Russell Senate Office Building SR-418,Veterans,2021-12-23,"['Daniel Akaka', 'Patrick W.Dunne, USN (Ret.)', 'J. DavidCox, R.N.', 'HowardPierce', 'William ""Bo""Rollins', 'KerryBaker']",https://www.veterans.senate.gov/hearings/watch?hearingid=747730FF-5056-A032-52CC-46DF80B7EE66,105.0,105.0,105.0,105.0,105.0
106,07/23/08,09:30AM,https://www.veterans.senate.gov/hearings/vas-response-to-the-needs-of-returning-guard-and-reserve-members,VA's Response to the Needs of Returning Guard and Reserve Members,Russell Senate Office Building SR-418,Veterans,2021-12-23,"['Daniel Akaka', 'Richard Burr', 'Jon Tester', 'Bradley G.Mayes', 'Donald L.Nelson', 'MarianneMathewson-Chapman, , ARNP, Major General (Ret.)', 'RoyMeredith', 'Joseph R.Scotti, Ph.D', 'Cynthia M.Rasmussen RN, MSN', 'John C.Boyd', 'Bradley A.Livingston']",https://www.veterans.senate.gov/hearings/watch?hearingid=7314E721-5056-A032-5289-D3C694A84EF8,106.0,106.0,106.0,106.0,106.0
107,09/11/08,09:30AM,https://www.veterans.senate.gov/hearings/legislative-presentation-of-the-american-legion-091108,Legislative Presentation of The American Legion 091108,345 Cannon Caucus Room ,Veterans,2021-12-23,[],,107.0,107.0,107.0,107.0,107.0
108,09/17/08,10:00AM,https://www.veterans.senate.gov/hearings/patrick-w-dunne-to-be-under-secretary-for-benefits-of-the-department-of-veterans-affairs,Patrick W. Dunne to be Under Secretary for Benefits of the Department of Veterans Affairs.,Russell Senate Office Building SR-418,Veterans,2021-12-23,['Daniel Akaka'],https://www.veterans.senate.gov/hearings/watch?hearingid=7765310F-5056-A032-5278-A2ADFF2B49A4,108.0,108.0,108.0,108.0,108.0
109,09/23/08,10:00AM,https://www.veterans.senate.gov/hearings/markup-of-the-nomination-of-patrick-w-dunne-to-be-under-secretary-for-benefits-of-the-department-of-veterans-affairs,Markup: Of the nomination of Patrick W. Dunne to be Under Secretary for Benefits of the Department of Veterans Affairs.,Reception Room ,Veterans,2021-12-23,[],,109.0,109.0,109.0,109.0,109.0
110,09/24/08,09:30AM,https://www.veterans.senate.gov/hearings/cooperation-and-collaboration-by-va-and-dod-on-information-technology-efforts,Cooperation and Collaboration by VA and DOD on Information Technology efforts,Russell Senate Office Building SR-418,Veterans,2021-12-23,"['Daniel Akaka', 'Valerie C.Melvin', 'S. WardCasscells', 'CharlesCampbell', 'MichaelKussman, MD', 'Paul A.Tibbits, MD', 'CliffFreeman', 'RossFletcher, MD']",https://www.veterans.senate.gov/hearings/watch?hearingid=75A70FAE-5056-A032-52B4-D85C36821DBD,110.0,110.0,110.0,110.0,110.0
111,01/14/09,10:00AM,https://www.veterans.senate.gov/hearings/nomination-of-general-eric-shinseki-to-be-secretary-of-veterans-affairs,Nomination of General Eric Shinseki to be Secretary of Veterans Affairs,Dirksen 106,Veterans,2021-12-23,"['Daniel Akaka', 'Richard Burr', 'EricShinseki', 'BobDole', 'Daniel K.Inouye']",https://www.veterans.senate.gov/hearings/watch?hearingid=D25BD38C-5056-A032-52AB-05E04117E9D3,111.0,111.0,111.0,111.0,111.0
112,01/28/09,09:30AM,https://www.veterans.senate.gov/hearings/veterans-organizations-priorities-for-the-111th-congress,Veterans Organizations' Priorities for the 111th Congress,Russell Senate Office Building SR-418,Veterans,2021-12-23,"['Daniel Akaka', 'Richard Burr', 'CarlBlake', 'DennisCullinan', 'ToddBowers', 'AdrianAtizado', 'JohnRowan', 'DeanStoline']",https://www.veterans.senate.gov/hearings/watch?hearingid=D059BE32-5056-A032-52B6-782330E6534D,112.0,112.0,112.0,112.0,112.0
113,02/11/09,09:30AM,https://www.veterans.senate.gov/hearings/review-of-veterans-disability-compensation-what-changes-are-needed-to-improve-the-appeals-process-,Review of Veterans' Disability Compensation: What Changes are Needed to Improve the Appeals Process? ,Russell Senate Office Building SR-418,Veterans,2021-12-23,"['Daniel Akaka', 'Richard Burr', 'Roland W. Burris', 'James P.Terry', 'Bruce E.Kasold', 'Richard PaulCohen', 'Barton F.Stichman', 'KerryBaker']",https://www.veterans.senate.gov/hearings/watch?hearingid=D5D713EA-5056-A032-5295-101D2B30DA79,113.0,113.0,113.0,113.0,113.0
114,02/24/09,02:00PM,https://www.veterans.senate.gov/hearings/to-receive-the-legislative-presentation-of-the-disabled-american-veterans,Legislative Presentation of the Disabled American Veterans,345 Cannon HOB ,Veterans,2021-12-23,"['Daniel Akaka', 'Richard Burr', 'Dick Durbin', 'Raymond E.Dempsey']",,114.0,114.0,114.0,114.0,114.0
115,02/26/09,10:00AM,https://www.veterans.senate.gov/hearings/caring-for-veterans-in-rural-areas,Caring for Veterans in Rural Areas,Russell Senate Office Building SR-418,Veterans,2021-12-23,"['Daniel Akaka', 'Richard Burr', 'Jon Tester', 'Patty Murray', 'AdamDarkins, MD', 'KaraHawthorne', 'Ricardo C.Flippin', 'ThomasLoftus, FACHE, FAOCOPM', 'MatthewKuntz', 'AlanWatson']",https://www.veterans.senate.gov/hearings/watch?hearingid=D402D639-5056-A032-5298-7482D02C9150,115.0,115.0,115.0,115.0,115.0
116,03/05/09,09:30AM,https://www.veterans.senate.gov/hearings/legislative-presentations-by-american-ex-prisoners-of-war-blinded-veterans-of-america-gold-star-wives-of-america-iraq-and-afghanistan-veterans-of-america-jewish-war-veterans-of-the-united-states-of-america-paralyzed-veterans-of-america-and-wounded-warrior-project,"Legislative Presentations by American Ex-Prisoners of War, Blinded Veterans of America, Gold Star Wives of America, Iraq and Afghanistan Veterans of America, Jewish War Veterans of the United States of America, Paralyzed Veterans of America, and Wounded Warrior Project",Dirksen 106,Veterans,2021-12-23,"['Daniel Akaka', 'Richard Burr', 'Charles A.Stenger,', 'DawnHalfaker', 'Kathryn A.Witt', 'NormanJones, Jr.', 'Randy L.Pleva, Sr.', 'IraNovoselsky', 'PatrickCampbell']",https://www.veterans.senate.gov/hearings/watch?hearingid=DF2F6777-5056-A032-5229-2D3D3F3AEB54,116.0,116.0,116.0,116.0,116.0
117,03/10/09,09:30AM,https://www.veterans.senate.gov/hearings/fy-2010-budget-for-veterans-programs,FY 2010 Budget for Veterans' Programs,Russell Senate Office Building SR-418,Veterans,2021-12-23,"['Daniel Akaka', 'Richard Burr', 'Eric K.Shinseki', 'CarlBlake', 'DennisCullinan', 'KerryBaker', 'Raymond C.Kelley', 'Rick Weidman', 'Steven A.Robertson']",https://www.veterans.senate.gov/hearings/watch?hearingid=DE11EFE4-5056-A032-5204-F4BB96580D9C,117.0,117.0,117.0,117.0,117.0
118,03/12/09,09:30AM,https://www.veterans.senate.gov/hearings/legislative-presentations-of-amvets-air-force-sergeants-association-fleet-reserve-association-non-commissioned-officers-association-military-order-of-the-purple-heart-the-retired-enlisted-association-military-officers-association-of-america-national-association-of-state-directors-of-veterans-affairs-and-vietnam-veterans-of-america,Legislative Presentations of AMVETS; Air Force Sergeants Association; Fleet Reserve Association; Non Commissioned Officers Association; Military Order of the Purple Heart; The Retired Enlisted Association; Military Officers Association of America; National Association of State Directors of Veterans Affairs; and Vietnam Veterans of America,Dirksen 106,Veterans,2021-12-23,"['Daniel Akaka', 'Charles F.Smith', 'John ChadHapner', 'H. GeneOverstreet, USMC (Ret.)', 'JeffRoy', 'JohnRowan', 'Joseph L.Barnes, USN (Ret.)', 'Robert H.Price', 'Robert F.Norton, USA (Ret.)', 'Charlie L.Flowers, Air Force (Ret.)']",https://www.veterans.senate.gov/hearings/watch?hearingid=DC39F1F2-5056-A032-5243-D367270F745E,118.0,118.0,118.0,118.0,118.0
119,03/18/09,09:30AM,https://www.veterans.senate.gov/hearings/legislative-presentation-of-the-veterans-of-foreign-wars-03-18-09,Legislative Presentation of the Veterans of Foreign Wars 03-18-09,334 Cannon HOB ,Veterans,2021-12-23,"['Daniel Akaka', 'Richard Burr', 'Glen M.Gardner, Jr.']",https://www.veterans.senate.gov/hearings/watch?hearingid=DAB7D2B3-5056-A032-52D5-48BEC18717DC,119.0,119.0,119.0,119.0,119.0
120,03/25/09,09:30AM,https://www.veterans.senate.gov/hearings/state-of-the-art-it-solutions-for-va-benefits-delivery,State-of-the-Art IT Solutions for VA Benefits Delivery,Russell Senate Office Building SR-418,Veterans,2021-12-23,"['Daniel Akaka', 'Richard Burr', 'Stephen W.Warren', 'Keith M.Wilson', 'Kim A.Graves', 'Scott A.Gaydos']",https://www.veterans.senate.gov/hearings/watch?hearingid=D98C04B6-5056-A032-521B-4E56D773ACB7,120.0,120.0,120.0,120.0,120.0
121,04/01/09,09:30AM,https://www.veterans.senate.gov/hearings/nomination-of-w-scott-gould-to-be-deputy-secretary-of-veterans-affairs-and-the-nomination-of-l-tammy-duckworth-to-be-an-assistant-secretary-of-veterans-affairs-for-public-and-intergovernmental-affairs,Nomination of W. Scott Gould to be Deputy Secretary of Veterans Affairs and the nomination of L. Tammy Duckworth to be an Assistant Secretary of Veterans Affairs for Public and Intergovernmental Affairs,Russell Senate Office Building SR-418,Veterans,2021-12-23,"['Daniel Akaka', 'Richard Burr', 'W. ScottGould', 'L. TammyDuckworth']",https://www.veterans.senate.gov/hearings/watch?hearingid=102F4A2D-5056-A032-525E-DCDFAFE27200,121.0,121.0,121.0,121.0,121.0
122,04/22/09,02:30PM,https://www.veterans.senate.gov/hearings/pending-health-related-legislation,Pending Health-Related Legislation,Russell Senate Office Building SR-418,Veterans,2021-12-23,"['Daniel Akaka', 'Richard Burr', 'Gerald M.Cross, MD, FAAFP', 'AmmieHilsabeck, RN', 'AdrianAtizado', 'Hilda R.Heady, MSW', 'Blake C.Ortner', 'RalphIbson']",https://www.veterans.senate.gov/hearings/watch?hearingid=0F40D351-5056-A032-527F-CAA9D2C05EEB,122.0,122.0,122.0,122.0,122.0
123,04/29/09,09:30AM,https://www.veterans.senate.gov/hearings/pending-benefits-related-legislation,Pending Benefits-Related Legislation,Dirksen 562,Veterans,2021-12-23,"['Daniel Akaka', 'Richard Burr', 'Bradley G.Mayes', 'Rebecca NoahPoynter', 'Raymond C.Kelley', 'RobertJackson', 'Iande Planque', 'R. ChuckMason']",https://www.veterans.senate.gov/hearings/watch?hearingid=05F14900-5056-A032-52FC-613E826C40F8,123.0,123.0,123.0,123.0,123.0
124,05/06/09,09:00AM,https://www.veterans.senate.gov/hearings/hearing-pending-nominations,Hearing: Pending Nominations,Russell Senate Office Building SR-418,Veterans,2021-12-23,"['Daniel Akaka', 'Richard Burr', 'John U.Seplveda', 'Will A.Gunn', 'Jose D.Riojas', 'Roger W.Baker']",https://www.veterans.senate.gov/hearings/watch?hearingid=10EA7C1F-5056-A032-52EA-7C06443ADB3B,124.0,124.0,124.0,124.0,124.0
125,05/21/09,09:30AM,https://www.veterans.senate.gov/hearings/mark-up-pending-legislation,Mark up: Pending Legislation,Russell Senate Office Building SR-418,Veterans,2021-12-23,"['Daniel Akaka', 'Richard Burr']",https://www.veterans.senate.gov/hearings/watch?hearingid=10AEE391-5056-A032-52F9-BDD789BAD444,125.0,125.0,125.0,125.0,125.0
126,06/10/09,09:30AM,https://www.veterans.senate.gov/hearings/oversight-hearing-on-vas-construction-process,Oversight Hearing on VA's Construction Process,Russell Senate Office Building SR-418,Veterans,2021-12-23,"['Daniel Akaka', 'Richard Burr', 'MichaelBennet', 'MarkUdall', 'EdPerimutter', 'Donald H.Orndoff, AIA', 'DavidWise', 'DennisCullinan', 'J. DavidCox, R.N.']",https://www.veterans.senate.gov/hearings/watch?hearingid=A2AE4718-5056-A032-5294-936B707EA490,126.0,126.0,126.0,126.0,126.0
127,06/24/09,09:30AM,https://www.veterans.senate.gov/hearings/oversight-of-va-quality-management-activities,Oversight of VA Quality Management Activities,Russell Senate Office Building SR-418,Veterans,2021-12-23,"['Daniel Akaka', 'Richard Burr', 'Robert A.Wise, M.D.', 'ThomasNolan,', 'Julie A.Watrous, RN, MS', 'Gerald M.Cross, MD, FAAFP']",https://www.veterans.senate.gov/hearings/watch?hearingid=A1C35566-5056-A032-52D1-6E032E972F98,127.0,127.0,127.0,127.0,127.0
128,06/29/09,10:00AM,https://www.veterans.senate.gov/hearings/philadelphia-va-medical-centers-terminated-cancer-treatment-program,Philadelphia VA Medical Center's Terminated Cancer Treatment Program,Philadelphia VA Medical Center ,Veterans,2021-12-23,"['Ricardo C.Flippin', 'GaryKao, M.D.,', 'Gerald M.Cross, MD, FAAFP', 'StevenReynolds']",,128.0,128.0,128.0,128.0,128.0
129,07/14/09,09:30AM,https://www.veterans.senate.gov/hearings/women-veterans-bridging-the-gaps-in-care,Women Veterans: Bridging the Gaps in Care,Russell Senate Office Building SR-418,Veterans,2021-12-23,"['Daniel Akaka', 'Richard Burr', 'Randall B.Williamson', 'PatriciaHayes, PH. D.', 'KaylaWilliams', 'TiaChristopher', 'JenniferOlds', 'GenevieveChase', 'Joy J.Ilem']",https://www.veterans.senate.gov/hearings/watch?hearingid=A58A0EE7-5056-A032-525C-B750E60A728A,129.0,129.0,129.0,129.0,129.0
130,07/22/09,10:00AM,https://www.veterans.senate.gov/hearings/nomination-of-raymond-jefferson-to-be-the-assistant-secretary-for-veterans-employment-and-training-and-joan-m-evans-to-be-the-assistant-secretary-of-veterans-affairs-for-congressional-and-legislative-affairs,Nomination of Raymond Jefferson to be the Assistant Secretary for Veterans' Employment and Training; and Joan M. Mooney to be the Assistant Secretary of Veterans Affairs for Congressional and Legislative Affairs,Russell Senate Office Building SR-418,Veterans,2021-12-23,"['Daniel Akaka', 'Richard Burr', 'Raymond M.Jefferson', 'Joan M.Mooney']",https://www.veterans.senate.gov/hearings/watch?hearingid=A4B0CA52-5056-A032-520A-7D5F0CC08602,130.0,130.0,130.0,130.0,130.0
131,07/29/09,09:15AM,https://www.veterans.senate.gov/hearings/review-of-veterans-disability-compensation-forging-a-path-forward,Review of Veterans' Disability Compensation: Forging a Path Forward,Russell Senate Office Building SR-418,Veterans,2021-12-23,"['Daniel Akaka', 'Richard Burr', 'NoelKoch', 'Patrick W.Dunne, USN (Ret.)', 'Michael P.Allen', 'DanielBertoni', 'JohnWilson']",https://www.veterans.senate.gov/hearings/watch?hearingid=A3B747CA-5056-A032-527F-16FACD019E4E,131.0,131.0,131.0,131.0,131.0
132,08/20/09,01:00PM,https://www.veterans.senate.gov/hearings/the-challenges-of-an-aging-va-medical-center_-omaha-ne,"The Challenges of an Aging VA Medical Center - Omaha, NE","Omahah VA Medical Center, 4101 Woolworth Avenue, Omaha, NE Education Conference Room",Veterans,2021-12-23,"['Mike Johanns', 'Donald H.Orndoff, AIA', 'LeeTerry', 'David G.Brown', 'Rowen K.Zetterman, MD, MACP, MACG', 'AmandaVazquez', 'Harold M.Maurer, M.D.']",,132.0,132.0,132.0,132.0,132.0
133,08/25/09,10:00AM,https://www.veterans.senate.gov/hearings/va-outreach-to-returning-guard-units_-oahu-hawaii,"VA Outreach to Returning Guard Units - Oahu, Hawaii","Oahu Veterans Center, 1298 Kukila Street, Honolulu, HI ",Veterans,2021-12-23,"['ClayPark', 'Tulsi GabbardTamayo', 'Raymond M.Jefferson', 'TraceyBetts', 'Gary M.Ishikawa', 'SheilaCullen']",,133.0,133.0,133.0,133.0,133.0
134,08/26/09,02:30PM,https://www.veterans.senate.gov/hearings/providing-care-for-rural-veterans-community-based-outpatient-clinics_-jessup-ga,"Providing Care for Rural Veterans: Community-Based Outpatient Clinics - Jessup, GA","Jesup, GA ",Veterans,2021-12-23,"['Johnny Isakson', 'Joseph A.Williams, RN, BSN, MPM', 'CortNordeoff', 'TomCook', 'Albert R.Spears']",,134.0,134.0,134.0,134.0,134.0
135,08/28/09,10:00AM,https://www.veterans.senate.gov/hearings/field-hearing-the-state-of-va-care-on-maui_-maui-hi,"POSTPONED:Field Hearing: The State of VA Care on Maui - Maui, HI","Maui, HI ",Veterans,2021-12-23,[],,135.0,135.0,135.0,135.0,135.0
136,09/10/09,09:30AM,https://www.veterans.senate.gov/hearings/joint-hearing-legislative-presentation-of-the-american-legion,Joint Hearing: Legislative Presentation of The American Legion,345 Cannon HOB ,Veterans,2021-12-23,"['Richard Burr', 'Clarence E.Hill']",,136.0,136.0,136.0,136.0,136.0
137,09/17/09,09:30AM,https://www.veterans.senate.gov/hearings/review-of-veterans-disability-compensation-benefits-in-the-21st-century,Review of Veterans' Disability Compensation: Benefits in the 21st Century,Russell Senate Office Building SR-418,Veterans,2021-12-23,"['Daniel Akaka', 'Richard Burr', 'GeorgeKettner,', 'James TerryScott, LTG USA (RET)', 'Patrick W.Dunne, USN (Ret.)', 'JohnWilson', 'KatyNeas', 'SusanProkop']",https://www.veterans.senate.gov/hearings/watch?hearingid=0DEF76E9-5056-A032-5211-7C8DB89FC5E3,137.0,137.0,137.0,137.0,137.0
138,09/30/09,09:30AM,https://www.veterans.senate.gov/hearings/vas-contracts-for-health-services,VA's Contracts for Health Services,Russell Senate Office Building SR-418,Veterans,2021-12-23,"['Daniel Akaka', 'Richard Burr', 'Joseph A.Williams, RN, BSN, MPM', 'Mary A.Curtis, APRN, BC', 'Tim S.McClain', 'John L.Earnest', 'MarjieShahani, MD']",https://www.veterans.senate.gov/hearings/watch?hearingid=AD656321-5056-A032-5249-254CB58D9EE9,138.0,138.0,138.0,138.0,138.0
139,10/08/09,09:30AM,https://www.veterans.senate.gov/hearings/va/dod-response-to-certain-military-exposures,VA/DOD Response to Certain Military Exposures,Dirksen 562,Veterans,2021-12-23,"['Daniel Akaka', 'Richard Burr', 'MichaelPartain', 'John R.Nuckols,', 'StacyPennington', 'Charles E.Feigley,', 'Robert F.Miller, M.D.', 'RussellPowell', 'HermanGibb,', 'LauriePaganelli', 'CraigPostlewaite, DVM, MPH', 'Michael R.Peterson, DVM, MPH, DRPH', 'PaulGillooly, .', 'John J.Resta', 'Eugene G.Payne, Jr']",https://www.veterans.senate.gov/hearings/watch?hearingid=1113FE06-5056-A032-5232-C3FB5956692A,139.0,139.0,139.0,139.0,139.0
140,11/05/09,10:00AM,https://www.veterans.senate.gov/hearings/va-and-indian-health-service-cooperation,VA and Indian Health Service Cooperation,Russell Senate Office Building SR-418,Veterans,2021-12-23,"['Daniel Akaka', 'Richard Burr', 'AndyJoseph', 'ClayPark', 'S. KevinHowlett', 'Randy E.Grinnell', 'James R.Floyd']",https://www.veterans.senate.gov/hearings/watch?hearingid=786EAD5C-5056-A032-52E5-0202097516EB,140.0,140.0,140.0,140.0,140.0
141,11/18/09,09:30AM,https://www.veterans.senate.gov/hearings/easing-the-burdens-through-employment,Easing the Burdens through Employment,Russell Senate Office Building SR-418,Veterans,2021-12-23,"['Daniel Akaka', 'Richard Burr', 'Raymond M.Jefferson', 'Peter ""Bull Frog""Wikul (Retired)', 'HelenTymes', 'LutzZiob', 'DexterDaniel', 'JoshuaLawton-Belous']",https://www.veterans.senate.gov/hearings/watch?hearingid=7956FD7C-5056-A032-5270-3461630D9B83,141.0,141.0,141.0,141.0,141.0
142,12/09/09,09:30AM,https://www.veterans.senate.gov/hearings/hearing-on-the-nomination-of-robert-a-petzel-md-to-be-under-secretary-for-health-of-the-department-of-veterans-affairs-and-raul-perea-henze-md-mph-to-be-assistant-secretary-of-veterans-affairs-for-policy-and-planning,"Hearing on the Nomination of Robert A. Petzel, MD, to be Under Secretary for Health of the Department of Veterans Affairs and Raul Perea-Henze, MD, MPH, to be Assistant Secretary of Veterans Affairs for Policy and Planning",Russell Senate Office Building SR-418,Veterans,2021-12-23,"['Daniel Akaka', 'Richard Burr', 'Robert A.Petzel, M.D.', 'RaulPerea-Henze, M.D.']",https://www.veterans.senate.gov/hearings/watch?hearingid=7A6570A3-5056-A032-5230-3363228B0C69,142.0,142.0,142.0,142.0,142.0
143,01/07/10,02:00PM,https://www.veterans.senate.gov/hearings/field-hearing-state-of-va-services-on-maui,Field Hearing: State of VA Services on Maui,"Maui Arts and Cultural Center, Maui, HI ",Veterans,2021-12-23,"['Daniel Akaka', 'MitchSkaggerberg', 'Rogelio G.Evangelista', 'Lloyd K.Sodetani', 'PaulLaub', 'TerryPoaipuni', 'Robert G. F.Lee', 'TraceyBetts', 'LindaHalliday', 'SheilaCullen']",https://www.veterans.senate.gov/hearings/watch?hearingid=3AE53A71-5056-A032-52E8-B43818D884EF,143.0,143.0,143.0,143.0,143.0
144,01/28/10,09:27AM,https://www.veterans.senate.gov/hearings/markup-pending-legislation-and-vote-on-the-nomination-of-raul-perea-henze-to-be-an-assistant-secretary-of-veterans-affairs-for-policy-and-planning,"Markup: Pending legislation, and vote on the nomination of Raul Perea-Henze to be an Assistant Secretary of Veterans Affairs for Policy and Planning",Russell Senate Office Building SR-418,Veterans,2021-12-23,"['Daniel Akaka', 'Bernie Sanders', 'John D. Rockefeller IV']",https://www.veterans.senate.gov/hearings/watch?hearingid=3A7BAD46-5056-A032-5267-B26E0EF8251C,144.0,144.0,144.0,144.0,144.0
145,02/16/10,10:30AM,https://www.veterans.senate.gov/hearings/field-hearing-on-services-for-veterans-in-alaska-02-16-10,Field Hearing on Services for Veterans in Alaska 02-16-10,Anchorage Assembly Chambers ,Veterans,2021-12-23,"['RicDavidge', 'Timothy PatrickCarroll', 'Mark M.Bilosz', 'Raymond M.Jefferson', 'Belinda J.Finn']",,145.0,145.0,145.0,145.0,145.0
146,02/17/10,01:00PM,https://www.veterans.senate.gov/hearings/field-hearing-on-services-for-veterans-in-alaska,Field Hearing on Services for Veterans in Alaska,Fairbanks North Star Borough Administrative Center ,Veterans,2021-12-23,"['RonWoolf', 'LindaBoisseau', 'SusanPendergrass', 'Mark M.Bilosz']",,146.0,146.0,146.0,146.0,146.0
147,02/26/10,09:30AM,https://www.veterans.senate.gov/hearings/fy-2011-budget-for-veterans-programs,FY 2011 Budget for Veterans' Programs,Russell Senate Office Building SR-418,Veterans,2021-12-23,"['Daniel Akaka', 'Eric K.Shinseki', 'RickWeidman', 'JohnWilson', 'Eric A.Hilleman', 'Raymond C.Kelley', 'CarlBlake', 'Steven A.Robertson']",https://www.veterans.senate.gov/hearings/watch?hearingid=6992400B-5056-A032-5271-3A30BBC70367,147.0,147.0,147.0,147.0,147.0
148,03/02/10,02:00PM,https://www.veterans.senate.gov/hearings/legislative-presentation-by-disabled-american-veterans,Legislative Presentation by Disabled American Veterans,345 Cannon HOB ,Veterans,2021-12-23,"['Daniel Akaka', 'Roberto ""Bobby""Barrera']",,148.0,148.0,148.0,148.0,148.0
149,03/03/10,09:30AM,https://www.veterans.senate.gov/hearings/mental-health-care-and-suicide-prevention-for-veterans,Mental Health Care and Suicide Prevention for Veterans,Russell Senate Office Building SR-418,Veterans,2021-12-23,"['Daniel J.Hanson', 'ClarenceJordan', 'M. DavidRudd, , ABPP', 'Gerald M.Cross, MD, FAAFP']",https://www.veterans.senate.gov/hearings/watch?hearingid=752BA1D9-5056-A032-5244-5AA096730076,149.0,149.0,149.0,149.0,149.0
150,03/04/10,09:30AM,https://www.veterans.senate.gov/hearings/legislative-presentations-by-paralyzed-veterans-of-america-jewish-war-veterans-military-,"Legislative Presentations by Paralyzed Veterans of America, Jewish War Veterans, Military ",345 Cannon HOB ,Veterans,2021-12-23,"['Daniel Akaka', 'RoyKekahuna', 'Rene A.Campos, USN (Ret)', 'Edwin M.Robins', 'GeneCrayton', 'AndrewKinard', 'James M.Sims', 'John R.McCauslin CMSgt, USAF (Ret.)', 'KennyHanson']",,150.0,150.0,150.0,150.0,150.0
151,03/09/10,09:30AM,https://www.veterans.senate.gov/hearings/legislative-presentation-by-veterans-of-foreign-wars,Legislative Presentation by Veterans of Foreign Wars,Dirksen SD-G50,Veterans,2021-12-23,"['Daniel Akaka', 'Thomas J.Tradewell Sr.']",https://www.veterans.senate.gov/hearings/watch?hearingid=6FF06B66-5056-A032-52FF-B1611C64C270,151.0,151.0,151.0,151.0,151.0
152,03/18/10,09:30AM,https://www.veterans.senate.gov/hearings/legislative-presentation-by-amvets-national-association-of-state-directors-of-veterans-affairs-non-commissioned-officers-association-gold-star-wives-the-retired-enlisted-association-fleet-reserve-association-vietnam-veterans-of-america-iraq-and-afghanistan-veterans-of-america,"Legislative Presentation by AMVETS, National Association of State Directors of Veterans Affairs, Non Commissioned Officers Association, Gold Star Wives, The Retired Enlisted Association, Fleet Reserve Association, Vietnam Veterans of America, Iraq and Afghanistan Veterans of America",Dirksen SD-G50,Veterans,2021-12-23,"['Daniel Akaka', 'Charlie L.Flowers, Air Force (Ret.)', 'Joseph L.Barnes, USN (Ret.)', 'TomTarantino', 'H. GeneOverstreet, USMC (Ret.)', 'TerrySchow', 'JohnRowan', 'Duane J.Miskulin', 'Vivianne CisnerosWersel, Au.D.']",https://www.veterans.senate.gov/hearings/watch?hearingid=6EC92D38-5056-A032-52B5-E31CEA01CC48,152.0,152.0,152.0,152.0,152.0
153,03/24/10,09:30AM,https://www.veterans.senate.gov/hearings/vas-plan-for-ending-homelessness-among-veterans,VA's Plan for Ending Homelessness among Veterans,Russell Senate Office Building SR-418,Veterans,2021-12-23,"['Daniel Akaka', 'PeteDougherty', 'MarkJohnston', 'Raymond M.Jefferson', 'ArnoldShipman', 'Dennis H.Parnell', 'Sandra A.Miller', 'PatrickRyan', 'SamTsemberis,']",https://www.veterans.senate.gov/hearings/watch?hearingid=6D4CE515-5056-A032-526E-109774F9A65F,153.0,153.0,153.0,153.0,153.0
